{
 "$schema": "../schema/tss.schema.json",
 "id": "strait-of-gibraltar",
 "name": "In the Strait of Gibraltar",
 "source": "IMO COLREG.2/Circ.66, Annex 1: amendments to the existing traffic separation scheme \"In the Strait of Gibraltar\", adopted by the Maritime Safety Committee at its 94th session (17-21 November 2014), implemented at 0000 UTC on 1 June 2015. Reference chart 445 of the Hydrographic Institute of the Spanish Navy (IHM), 4th edition June 2007, datum WGS 84.",
 "sourceDate": "2014-11-21",
 "inForce": "2015-06-01",
 "datum": "WGS84",
 "referenceChart": "IHM 445, 4th edition, June 2007",
 "checkedBy": "Unverified transcription: values moved unchanged from the points table of tools/build_chart.py on 2026-09-06 and read back against the text of COLREG.2/Circ.66 Annex 1. A navigator must still check every position against IHM chart 445 (or the current edition) and the circular in force before the chart is trusted at sea.",
 "checkedOn": "2026-09-06",
 "notes": [
  "Point ids are the position numbers of Annex 1. Positions are written as degrees and decimal minutes exactly as printed in the circular; the builder converts them with degrees + minutes / 60.",
  "Points with role 'construction' are not in the circular: they carry an inshore-zone boundary inland (a meridian of an IMO point at a latitude well over the land) so that clipToLand can cut the zone at the OpenStreetMap coastline.",
  "Order matters: the lists below are the order the polygons are written to chart-data.js and the order the app checks and draws them.",
  "The eastern lane pair (points 1-2) runs 252/072 true; flowDeg keeps the cardinal 270/090 the app used before this file existed so the spoken crossing headings (180/000) do not change. Switch to 252/072 only after replaying the east route (node tools/replay.js) and reviewing the new crossing headings.",
  "Anchorage Alpha (note 1 of the circular) is inside the south-western inshore traffic zone; ships bound for it enter that zone by its western limit from the Atlantic or by its eastern limit from Tanger-Med or the Mediterranean. Ships bound for or leaving Tanger-Med use the traffic lanes (rule 10)."
 ],
 "rules": {
  "crossing": {
   "rule": "rightAngles",
   "colreg": "10(c)",
   "text": "Cross a traffic lane on a heading as nearly as practicable at right angles to the general direction of traffic flow: the app steers to flowDeg + 90 or flowDeg - 90, whichever is closer to the leg course, and does not slow down inside the lane."
  }
 },
 "points": [
  {"id": "1", "lat": "35 59.01 N", "lon": "5 25.68 W"},
  {"id": "2", "lat": "35 58.36 N", "lon": "5 28.19 W"},
  {"id": "3", "lat": "35 56.70 N", "lon": "5 34.71 W"},
  {"id": "4", "lat": "35 56.21 N", "lon": "5 36.48 W"},
  {"id": "5", "lat": "35 56.21 N", "lon": "5 44.98 W"},
  {"id": "6", "lat": "36 02.80 N", "lon": "5 19.68 W"},
  {"id": "7", "lat": "36 01.21 N", "lon": "5 25.68 W"},
  {"id": "8", "lat": "36 00.35 N", "lon": "5 28.98 W"},
  {"id": "9", "lat": "35 58.68 N", "lon": "5 35.44 W"},
  {"id": "10", "lat": "35 58.41 N", "lon": "5 36.48 W"},
  {"id": "11", "lat": "35 58.41 N", "lon": "5 44.98 W"},
  {"id": "12", "lat": "35 52.51 N", "lon": "5 44.98 W"},
  {"id": "13", "lat": "35 53.81 N", "lon": "5 36.48 W"},
  {"id": "14", "lat": "35 54.55 N", "lon": "5 33.90 W"},
  {"id": "15", "lat": "35 56.35 N", "lon": "5 27.40 W"},
  {"id": "16", "lat": "35 56.84 N", "lon": "5 25.68 W"},
  {"id": "17", "lat": "35 58.78 N", "lon": "5 18.55 W"},
  {"id": "18", "lat": "35 54.45 N", "lon": "5 25.68 W"},
  {"id": "19", "lat": "35 54.88 N", "lon": "5 27.40 W"},
  {"id": "20", "lat": "35 52.87 N", "lon": "5 36.70 W"},
  {"id": "21", "lat": "35 52.06 N", "lon": "5 36.30 W"},
  {"id": "22", "lat": "35 51.10 N", "lon": "5 36.20 W"},
  {"id": "23", "lat": "35 52.18 N", "lon": "5 34.00 W"},
  {"id": "24", "lat": "35 51.20 N", "lon": "5 32.40 W"},
  {"id": "25", "lat": "35 49.09 N", "lon": "5 44.98 W"},
  {"id": "itz_n_nw", "role": "construction", "lat": 36.12, "lonOf": "11", "note": "Western limit of the northern inshore zone (meridian 5 44.98 W) carried north over the Spanish coast."},
  {"id": "itz_n_ne", "role": "construction", "lat": 36.12, "lonOf": "7", "note": "Eastern limit of the northern inshore zone (meridian 5 25.68 W) carried north over the Spanish coast."},
  {"id": "coast_24", "role": "construction", "lat": 35.78, "lonOf": "24", "note": "Meridian of point 24 carried south over the Moroccan coast (boundary between the south-western inshore zone and the free navigation area)."},
  {"id": "coast_12", "role": "construction", "lat": 35.78, "lonOf": "12", "note": "Meridian of point 12 (5 44.98 W) carried south over the Moroccan coast (western limit of the south-western inshore zone)."},
  {"id": "coast_19", "role": "construction", "lat": 35.78, "lonOf": "19", "note": "Meridian of point 19 carried south over the Moroccan coast (eastern limit of the free navigation area)."}
 ],
 "separationZones": [
  {
   "id": "zone_b",
   "name": "Separation zone (west)",
   "paragraph": "b",
   "centreline": ["3", "4", "5"],
   "halfWidthNm": 0.25,
   "region": ["9", "10", "11", "12", "13", "14"],
   "level": "warn",
   "enter": "In the separation zone. Keep crossing, do not linger.",
   "leave": null
  },
  {
   "id": "zone_a",
   "name": "Separation zone (east)",
   "paragraph": "a",
   "centreline": ["1", "2"],
   "halfWidthNm": 0.25,
   "region": ["7", "8", "15", "16"],
   "level": "warn",
   "enter": "In the separation zone. Keep crossing, do not linger.",
   "leave": null
  }
 ],
 "lanes": [
  {
   "id": "west_wb",
   "name": "Westbound lane (west)",
   "paragraph": "d",
   "flowDeg": 270,
   "region": ["9", "10", "11", "12", "13", "14"],
   "separationZone": "zone_b",
   "side": "north",
   "crossing": "rightAngles",
   "arrows": {"along": ["3", "4", "5"], "offsetNorthNm": 1.2, "perSegment": 4},
   "level": "danger",
   "enter": "Entering the WESTBOUND traffic lane. Ships come from your LEFT, from the east. Keep crossing at right angles, do not slow down.",
   "leave": "Clear of the westbound lane."
  },
  {
   "id": "west_eb",
   "name": "Eastbound lane (west)",
   "paragraph": "e",
   "flowDeg": 90,
   "region": ["9", "10", "11", "12", "13", "14"],
   "separationZone": "zone_b",
   "side": "south",
   "crossing": "rightAngles",
   "arrows": {"along": ["5", "4", "3"], "offsetNorthNm": -1.3, "perSegment": 4},
   "level": "danger",
   "enter": "Entering the EASTBOUND traffic lane. Ships come from your RIGHT, from the west. Keep crossing at right angles.",
   "leave": "Clear of the eastbound lane."
  },
  {
   "id": "east_wb",
   "name": "Westbound lane (east)",
   "paragraph": "c",
   "flowDeg": 270,
   "trueAxisDeg": 252,
   "region": ["7", "8", "15", "16"],
   "separationZone": "zone_a",
   "side": "north",
   "crossing": "rightAngles",
   "arrows": {"along": ["1", "2"], "offsetNorthNm": 1.1, "perSegment": 4},
   "level": "danger",
   "enter": "Entering the WESTBOUND traffic lane (east part). Ships come from the east. Cross at right angles.",
   "leave": "Clear of the westbound lane."
  },
  {
   "id": "east_eb",
   "name": "Eastbound lane (east)",
   "paragraph": "f",
   "flowDeg": 90,
   "trueAxisDeg": 72,
   "region": ["7", "8", "15", "16"],
   "separationZone": "zone_a",
   "side": "south",
   "crossing": "rightAngles",
   "arrows": {"along": ["2", "1"], "offsetNorthNm": -1.0, "perSegment": 4},
   "level": "danger",
   "enter": "Entering the EASTBOUND traffic lane (east part). Ships come from the west. Cross at right angles.",
   "leave": "Clear of the eastbound lane."
  }
 ],
 "precautionary": [
  {
   "id": "prec_east",
   "name": "Precautionary area (east, Gibraltar-Ceuta)",
   "paragraph": "g",
   "region": ["6", "7", "16", "17"],
   "level": "warn",
   "enter": "Entering the precautionary area. Ships converge from Algeciras, Gibraltar, Ceuta and Tanger-Med. Sharp lookout.",
   "leave": "Leaving the precautionary area."
  },
  {
   "id": "prec_tm",
   "name": "Precautionary area Tanger-Med",
   "paragraph": "h",
   "region": ["8", "9", "14", "15"],
   "level": "warn",
   "enter": "Entering the Tanger-Med precautionary area. Ships turning into and out of the port.",
   "leave": "Leaving the precautionary area."
  }
 ],
 "inshoreZones": [
  {
   "id": "itz_n",
   "name": "Northern inshore traffic zone (Spain)",
   "region": ["7", "8", "9", "10", "11", "itz_n_nw", "itz_n_ne"],
   "clipToLand": true,
   "level": "info",
   "enter": "In the Spanish inshore traffic zone. Stay north of the lanes.",
   "leave": "Leaving the Spanish inshore zone."
  },
  {
   "id": "itz_se",
   "name": "South-eastern inshore traffic zone",
   "region": ["16", "15", "19", "18"],
   "clipToLand": false,
   "level": "info",
   "enter": "In the south-eastern inshore zone (Morocco).",
   "leave": null
  },
  {
   "id": "itz_sw",
   "name": "South-western inshore traffic zone (Morocco)",
   "region": ["12", "13", "14", "20", "21", "22", "23", "24", "coast_24", "coast_12", "25"],
   "clipToLand": true,
   "level": "info",
   "enter": "In the Moroccan inshore traffic zone. Follow the coast to Tangier.",
   "leave": "Leaving the Moroccan inshore zone."
  }
 ],
 "freeAreas": [
  {
   "id": "free_tm",
   "name": "Free navigation area off Tanger-Med (port approaches, ferries)",
   "region": ["15", "14", "20", "21", "22", "23", "24", "coast_24", "coast_19", "19"],
   "clipToLand": true,
   "level": "warn",
   "enter": "Off Tanger-Med: ferries and container ships manoeuvring. Keep clear of the port approaches.",
   "leave": "Clear of the Tanger-Med approaches."
  }
 ],
 "anchorages": [
  {
   "id": "anch_alpha",
   "name": "Anchorage Alpha (Tanger-Med ships)",
   "lat": "35 51.05 N",
   "lon": "5 40.34 W",
   "radiusNm": 0.4,
   "note": "Circle of 0.4 nm radius inside the south-western inshore traffic zone (circular note 1). The passage file alerts on it as hazard anch_alpha."
  }
 ]
}
